User Input,Chatbot Response,Timestamp
"Which city is the capital of Maharashtra?", "The capital of Maharashtra is Mumbai.", "2024-12-07 15:21:45"
hi,Nothing much,2024-12-07 11:57:49
Tell me about Maharashtra,Hello,2024-12-07 11:58:06
what is the capital of Maharashtra,The capital of Maharashtra is Mumbai.,2024-12-07 11:58:53
Tell me about Maharashtra,"Maharashtra is a state located in the western region of India. It is the second-most populous state and has Mumbai as its capital. Maharashtra is known for its diverse culture, historical landmarks, beaches, and is a major contributor to India's economy.",2024-12-07 12:12:12
tourist places in maharashtra,"Famous tourist places in Maharashtra include Ajanta and Ellora Caves, Gateway of India, Mahabaleshwar, Lonavala, and more.",2024-12-07 12:55:04
tourist places in maharashtra,"Famous tourist places in Maharashtra include Ajanta and Ellora Caves, Gateway of India, Mahabaleshwar, Lonavala, and more.",2024-12-07 12:55:12
